PM_ID,Title,Abstract,Journal,Year,PMC_ID,DOI,Classification,Community type,Substrate,Product,Organisms,Family
29631180,Synthetic Escherichia coli-Corynebacterium glutamicum consortia for l-lysine production from starch and sucrose.,"In the biorefinery concept renewable feedstocks are converted to a multitude of value-added compounds irrespective of seasonal or other variations of the complex biomass substrates. Conceptionally, this can be realized by specialized single microbial strains or by co-culturing various strain combinations. In the latter approach strains for substrate conversion and for product formation can be combined. This study addressed the construction of binary microbial consortia based on starch- and sucrose-based production of l-lysine and derived value-added compounds. A commensalism-based synthetic consortium for l-lysine production from sucrose was developed combining an l-lysine auxotrophic, naturally sucrose-negative E. coli strain with a C. glutamicum strain able to produce l-lysine that secretes fructose when grown with sucrose due to deletion of the fructose importer gene ptsF. Mutualistic synthetic consortia with an l-lysine auxotrophic, α-amylase secreting E. coli strain and naturally amylase-negative C. glutamicum strains was implemented for production of valuable fine chemicals from starch.",Bioresource technology,2018,None,10.1016/j.biortech.2018.03.113,1,Defined,"Starch, Sucrose",L-lysine,"Escherichia coli, Corynebacterium glutamicum","Enterobacteriaceae, Corynebacteriaceae"
36167174,Synthetic design of methanotroph co-cultures and their immobilization within polymers containing magnetic nanoparticles to enhance methanol production from wheat straw-based biogas.,"In this study, various methanotroph co-cultures were designed to enhance methanol production from biogas produced through the anaerobic digestion of wheat straw (WS). Furthermore, whole-cell immobilization was performed using magnetic nanoparticle (MNP)-loaded polymers to develop an efficient bioprocess. The anaerobic digestion of WS by cattle dung yielded 219 L/kg of total solids reduced. Methanol produced was 5.08 and 6.39 mmol/L by pure- and co-cultures from biogas, respectively. The optimization of process parameters enhanced methanol production to 6.82 mmol/L by co-culturing Mithylosinus sporium and Methylocella tundrae. The immobilized co-culture within the MNP-doped polymers exhibited much higher cumulative methanol of up to 70.74 mmol/L than the production of 22.34 mmol/L by free cells after ten cycles of reuse. This study suggests that MNP-doped polymer-based immobilization of methanotrophs is a unique approach for producing renewable fuels from biomass-derived biogas, a greenhouse gas.",Bioresource technology,2022,None,10.1016/j.biortech.2022.128032,1,Defined,Syngas,Methanol_p,"Methylosinus sporium, Methylocella tundrae","Methylocystaceae, Beijerinckiaceae"
25943991,Feasibility of biohydrogen production from industrial wastes using defined microbial co-culture.,"The development of clean or novel alternative energy has become a global trend that will shape the future of energy. In the present study, 3 microbial strains with different oxygen requirements, including Clostridium acetobutylicum ATCC 824, Enterobacter cloacae ATCC 13047 and Kluyveromyces marxianus 15D, were used to construct a hydrogen production system that was composed of a mixed aerobic-facultative anaerobic-anaerobic consortium. The effects of metal ions, organic acids and carbohydrate substrates on this system were analyzed and compared using electrochemical and kinetic assays. It was then tested using small-scale experiments to evaluate its ability to convert starch in 5 L of organic wastewater into hydrogen. For the one-step biohydrogen production experiment, H1 medium (nutrient broth and potato dextrose broth) was mixed directly with GAM broth to generate H2 medium (H1 medium and GAM broth). Finally, Clostridium acetobutylicum ATCC 824, Enterobacter cloacae ATCC 13047 and Kluyveromyces marxianus 15D of three species microbial co-culture to produce hydrogen under anaerobic conditions. For the two-step biohydrogen production experiment, the H1 medium, after cultured the microbial strains Enterobacter cloacae ATCC 13047 and Kluyveromyces marxianus 15D, was centrifuged to remove the microbial cells and then mixed with GAM broth (H2 medium). Afterward, the bacterial strain Clostridium acetobutylicum ATCC 824 was inoculated into the H2 medium to produce hydrogen by anaerobic fermentation.",Biological research,2015,4427975,10.1186/s40659-015-0015-x,1,Defined,Industrial waste,Hydrogen,"Clostridium acetobutylicum, Enterobacter cloacae, Kluyveromyces marxianus","Clostridiaceae, Enterobacteriaceae, Saccharomycetaceae"
19466556,Bio-hydrogen production from cellulose by sequential co-culture of cellulosic hydrogen bacteria of Enterococcus gallinarum G1 and Ethanoigenens harbinense B49.,"Microbial conversion of lignocellulose to hydrogen is a fascinating way to provide a renewable energy source. A mesophilic bacterium strain G1 that had high cellulose degradation and hydrogen production activity (2.38 mmol H(2) g(-1) cellulose) was isolated from rumen fluid and identified as the Enterococcus gallinarum. Hydrogen production from cellulose by using sequential co-cultures of a cellulosic-hydrolysis bacterium G1 and Ethanoigenens harbinense B49 was investigated. With an initial Avicel concentration of 5 g l(-l), the sequential co-culture with G1 and strain Ethanoigenens harbinense B49 produced H(2) yield approximately 2.97 mmol H(2) g(-1) cellulose for the co-culture system.",Biotechnology letters,2009,None,10.1007/s10529-009-0028-z,1,Defined,Cellulose,Hydrogen,"Enterococcus gallinarum, Ethanoligenens harbinense","Enterococcaceae, Oscillospiraceae"
23959872,Design and characterization of synthetic fungal-bacterial consortia for direct production of isobutanol from cellulosic biomass.,"Synergistic microbial communities are ubiquitous in nature and exhibit appealing features, such as sophisticated metabolic capabilities and robustness. This has inspired fast-growing interest in engineering synthetic microbial consortia for biotechnology development. However, there are relatively few reports of their use in real-world applications, and achieving population stability and regulation has proven to be challenging. In this work, we bridge ecology theory with engineering principles to develop robust synthetic fungal-bacterial consortia for efficient biosynthesis of valuable products from lignocellulosic feedstocks. The required biological functions are divided between two specialists: the fungus Trichoderma reesei, which secretes cellulase enzymes to hydrolyze lignocellulosic biomass into soluble saccharides, and the bacterium Escherichia coli, which metabolizes soluble saccharides into desired products. We developed and experimentally validated a comprehensive mathematical model for T. reesei/E. coli consortia, providing insights on key determinants of the system's performance. To illustrate the bioprocessing potential of this consortium, we demonstrate direct conversion of microcrystalline cellulose and pretreated corn stover to isobutanol. Without costly nutrient supplementation, we achieved titers up to 1.88 g/L and yields up to 62% of theoretical maximum. In addition, we show that cooperator-cheater dynamics within T. reesei/E. coli consortia lead to stable population equilibria and provide a mechanism for tuning composition. Although we offer isobutanol production as a proof-of-concept application, our modular system could be readily adapted for production of many other valuable biochemicals. ",Proceedings of the National Academy of Sciences of the United States of America,2013,3767521,10.1073/pnas.1218447110,1,Defined,Lignocellulose,Butanol,"Trichoderma reesei, Escherichia coli","Hypocreaceae, Enterobacteriaceae"
23831709,Bispecific antibodies with natural architecture produced by co-culture of bacteria expressing two distinct half-antibodies.,"By enabling the simultaneous engagement of two distinct targets, bispecific antibodies broaden the potential utility of antibody-based therapies. However, bispecific-antibody design and production remain challenging, owing to the need to incorporate two distinct heavy and light chain pairs while maintaining natural nonimmunogenic antibody architecture. Here we present a bispecific-antibody production strategy that relies on co-culture of two bacterial strains, each expressing a half-antibody. Using this approach, we produce 28 unique bispecific antibodies. A bispecific antibody against the receptor tyrosine kinases MET and EGFR binds both targets monovalently, inhibits their signaling, and suppresses MET and EGFR-driven cell and tumor growth. Our strategy allows rapid generation of bispecific antibodies from any two existing antibodies and yields milligram to gram quantities of bispecific antibodies sufficient for a wide range of discovery and preclinical applications. ",Nature biotechnology,2013,None,10.1038/nbt.2621,1,Defined,Amino acid medium,Antibodies,Escherichia coli,Enterobacteriaceae
29205274,Production of cellulosic organic acids via synthetic fungal consortia.,"Consolidated bioprocessing (CBP) is a potential breakthrough technology for reducing costs of biochemical production from lignocellulosic biomass. Production of cellulase enzymes, saccharification of lignocellulose, and conversion of the resulting sugars into a chemical of interest occur simultaneously within a single bioreactor. In this study, synthetic fungal consortia composed of the cellulolytic fungus Trichoderma reesei and the production specialist Rhizopus delemar demonstrated conversion of microcrystalline cellulose (MCC) and alkaline pre-treated corn stover (CS) to fumaric acid in a fully consolidated manner without addition of cellulase enzymes or expensive supplements such as yeast extract. A titer of 6.87 g/L of fumaric acid, representing 0.17 w/w yield, were produced from 40 g/L MCC with a productivity of 31.8 mg/L/hr. In addition, lactic acid was produced from MCC using a fungal consortium with Rhizopus oryzae as the production specialist. These results are proof-of-concept demonstration of engineering synthetic microbial consortia for CBP production of naturally occurring biomolecules.",Biotechnology and bioengineering,2018,None,10.1002/bit.26509,1,Defined,Lignocellulose,Fumaric acid,"Trichoderma reesei, Rhizopus delemar","Hypocreaceae, Rhizopodaceae"
23397222,Microbial consortia for hydrogen production enhancement.,"Ten efficient hydrogen-producing strains affiliated to the Clostridium genus were used to develop consortia for hydrogen production. In order to determine their saccharolytic and proteolytic activities, glucose and meat extract were tested as fermentation substrates, and the best hydrogen-producing strains were selected. The C. roseum H5 (glucose-consuming) and C. butyricum R4 (protein-degrading) co-culture was the best hydrogen-producing co-culture. The end-fermentation products for the axenic cultures and co-cultures were analyzed. In all cases, organic acids, mainly butyrate and acetate, were produced lowering the pH and thus inhibiting further hydrogen production. In order to replace the need for reducing agents for the anaerobic growth of clostridia, a microbial consortium including Clostridium spp. and an oxygen-consuming microorganism able to form dense granules (Streptomyces sp.) was created. Increased yields of hydrogen were achieved. The effect of adding a butyrate-degrading bacteria and an acetate-consuming archaea to the consortia was also studied.",Current microbiology,2013,None,10.1007/s00284-013-0328-3,1,Defined,Meat extract,Hydrogen,"Clostridium roseum, Clostridium butyricum",Clostridiaceae
30854474,Metabolite-based mutualism enhances hydrogen production in a two-species microbial consortium.,"Sustainable hydrogen production from renewable and low-cost substrates is very important to mitigate environmental and energy-related issues. Microbial consortia are promising for diverse bioenergy and environmental applications, yet microbial interactions are not fully understood. Here, we present comprehensive investigation on how two species in an artificial microbial consortium, consisting of <i>Bacillus cereus</i> A1 and <i>Brevundimonas naejangsanensis</i> B1, mutually cooperate to achieve an overall enhancement in hydrogen production and starch utilization. In this consortium, strains A1 and B1 secrete α-amylase and glucoamylase that are functionally complementary in starch hydrolysis. Moreover, strain A1 converts starch into lactate as a carbon source and electron donor, supporting the cell growth and hydrogen generation of strain B1. In return, strain B1 produces formate as an electron shuttle to strain A1 to enhance hydrogen production. The co-culture re-directs the overall metabolic flux, facilitates the cell growth, and up-regulates the key genes of hydrogen production and starch hydrolysis.",Communications biology,2019,6395672,10.1038/s42003-019-0331-8,1,Defined,Starch,Hydrogen,"Bacillus cereus, Brevundimonas naejangsanensis","Bacillaceae, Caulobacteraceae"
27801903,Enhanced microbial electrosynthesis by using defined co-cultures.,"Microbial uptake of free cathodic electrons presents a poorly understood aspect of microbial physiology. Uptake of cathodic electrons is particularly important in microbial electrosynthesis of sustainable fuel and chemical precursors using only CO<sub>2</sub> and electricity as carbon, electron and energy source. Typically, large overpotentials (200 to 400 mV) were reported to be required for cathodic electron uptake during electrosynthesis of, for example, methane and acetate, or low electrosynthesis rates were observed. To address these limitations and to explore conceptual alternatives, we studied defined co-cultures metabolizing cathodic electrons. The Fe(0)-corroding strain IS4 was used to catalyze the electron uptake reaction from the cathode forming molecular hydrogen as intermediate, and Methanococcus maripaludis and Acetobacterium woodii were used as model microorganisms for hydrogenotrophic synthesis of methane and acetate, respectively. The IS4-M. maripaludis co-cultures achieved electromethanogenesis rates of 0.1-0.14 μmol cm<sup>-2</sup> h<sup>-1</sup> at -400 mV vs standard hydrogen electrode and 0.6-0.9 μmol cm<sup>-2</sup> h<sup>-1</sup> at -500 mV. Co-cultures of strain IS4 and A. woodii formed acetate at rates of 0.21-0.23 μmol cm<sup>-2</sup> h<sup>-1</sup> at -400 mV and 0.57-0.74 μmol cm<sup>-2</sup> h<sup>-1</sup> at -500 mV. These data show that defined co-cultures coupling cathodic electron uptake with synthesis reactions via interspecies hydrogen transfer may lay the foundation for an engineering strategy for microbial electrosynthesis.",The ISME journal,2017,5322301,10.1038/ismej.2016.149,1,Defined,CO2,Electricity,"Desulfobacterium corrodens, Acetobacterium woodii","Desulfobacteriaceae, Eubacteriaceae"
27680538,Engineering of a microbial coculture of Escherichia coli strains for the biosynthesis of resveratrol.,"Resveratrol is a plant natural product with many health-protecting effects which makes it an attractive chemical both for academic studies and industrial purposes. However, the low quantities naturally produced by plants as well as the unsustainable procedures of extraction, purification and concentration have prompted many biotechnological approaches to produce this chemical in large quantities from renewable sources. None of these approaches have considered a microbial coculture strategy to produce this compound. The aim of this study was to prove the functionality of a microbial coculture for the biosynthesis of resveratrol.",Microbial cell factories,2016,5041211,10.1186/s12934-016-0562-z,1,Defined,Glycerol,Resveratrol,Escherichia coli,Enterobacteriaceae
,Metabolic engineering of Escherichia coli for microbial synthesis of monolignols,,Metabolic Engineering,2017,,,,Defined,Glucose,"caffeyl alcohol, coniferyl alcohol",Escherichia coli,Enterobacteriaceae
,Escherichia coli modular coculture system for resveratrol glucosides production,,World Journal of Microbiology and Biotechnology,2018,,,,Defined,Glucose,Resveratrol,Escherichia coli,Enterobacteriaceae
,Simultaneous fermentation of biomass-derived sugars to ethanol by a co-culture of an engineered Escherichia coli and Saccharomyces cerevisiae,,Bioresource Technology,2019,,,,Defined,Lignocellulose,Ethanol,"Escherichia coli, Saccharomyces cerevisiae","Enterobacteriaceae, Saccharomycetaceae"
,Engineered monoculture and co-culture of methylotrophic yeast for de novo production of monacolin J and lovastatin from methanol,,Metabolic Engineering,2018,,,,Defined,Methanol_s,"Monacolin, lovastatin",Pichia pastoris,Phaffomycetaceae
,Fermentative Escherichia coli makes a substantial contribution to H2 production in coculture with phototrophic Rhodopseudomonas palustris,,FEMS Microbiology Letters,2019,,,,Defined,Glucose,Hydrogen,"Escherichia coli, Rhodopseudomonas palustris","Enterobacteriaceae, Nitrobacteraceae"
,High-yield production of multiple O-methylated phenylpropanoids by the engineered Escherichia coli-Streptomyces cocultivation system,,Microbial Cell Factories,2019,,,,Defined,Amino acid medium,O-methylated phenylpropanoids,"Escherichia coli, Streptomyces venezuelae","Enterobacteriaceae, Streptomycetaceae"
,Engineering microbial consortia for high-performance cellulosic hydrolyzates-fed microbial fuel cells,,Frontiers in microbiology,2019,,,,Defined,Lignocellulose,Electricity,"Klebsiella pneumonia, Shewanella oneidensis","Enterobacteriaceae, Shewanellaceae"
,Combined evolutionary engineering and genetic manipulation improve low pH tolerance and butanol production in a synthetic microbial Clostridium community,,Biotechnology and Bioengineering,2020,,,,Defined,Glucose,Butanol,"Clostridium beijerinckii, Clostridium cellulovorans",Clostridiaceae
,"Direct Ethanol Production from Lignocellulosic Materials by Mixed Culture of Wood Rot Fungi Schizophyllum commune, Bjerkandera adusta, and Fomitopsis palustris",,Fermentation,2019,,,,Defined,Lignocellulose,Ethanol,"Schizophyllum commune, Bjerkandera adusta, Fomitopsis palustris","Schizophyllaceae, Phanerochaetaceae, Fomitopsidaceae"
,Developing a coculture for enhanced butanol production by Clostridium beijerinckii and Saccharomyces cerevisiae,,Bioresource technology,2019,,,,Defined,Glucose,Butanol,"Saccharomyces cerevisiae, Clostridium beijerinckii","Saccharomycetaceae, Clostridiaceae"
,Mixed culture biocatalytic production of the high-value biochemical 7-methylxanthine,,Journal of Biological Engineering,2023,,,,Defined,Amino acid medium,7-methylxanthine,Escherichia coli,Enterobacteriaceae
33220542,Short chain carboxylic acids production and dynamicity of microbial communities from co-digestion of swine manure and corn silage.,"Short chain carboxylic acids (SCCAs) have attracted much attention due to their wide application and benefit of high economy. This study investigated the influence of organic load rates (OLRs) on short-chain carboxylic acids (SCCAs) production and microbial communities for co-digestion of swine manure (SM) and corn silage (CS) during four different OLRs stages in a semi-continuous mode. The results showed that relatively stable SCCAs concentration of 10.5-13.6 g COD/L and SCCAs yield of 0.42 mg COD/mg VS was achieved at OLR of 3.0 g VS/L·d. The maximum concentration of 19.1 g COD/L was achieved at 3.5 g VS/L·d. Volatile fatty acids (VFAs) (include acetic, n-butyric and caproic acids) accounted for approximately 80% of SCCAs. Hydrolysis bacteria (HB) including Clostridium, Terriporobacter, Intestinibacter, and Turiibacter decreased with the increase of OLR, while acidogenic bacteria (AB) including Acetobacter, Lactobacillus, Aeriscardovia, and Pseudomonas increased, resulting in insufficient degradation of CS.",Bioresource technology,2021,None,10.1016/j.biortech.2020.124400,1,Undefined,"Manure compost, Lignocellulose",SCCA,,Undefined
28130132,Biosynthesis of poly (3-hydroxybutyrate-co-3-hydroxyvalerate) by bacterial community from propylene oxide saponification wastewater residual sludge.,"The saponification wastewater from the process of propylene oxide (PO) production is contaminated with high chemical oxygen demand (COD) and chlorine contents. Although the activated sludge process could treat the PO saponification wastewater effectively, the residual sludge was difficult to be disposed properly. In this research, microbes in PO saponification wastewater residual sludge were acclimated to produce poly (3-hydroxybutyrate-co-3-hydroxyvalerate) (PHBV) from volatile fatty acids. Through Miseq Illumina highthroughput sequencing, the bacterial community discrepancy between the original and the acclimated sludge samples were analyzed. The proportions of Bacillus, Acinetobacter, Brevundimonas and Pseudomonas, the potential PHBV-producers in the residual sludge, were all obviously increased. In the batch fermentation, the production of PHBV could achieve 4.262g/L at 300min, with the content increased from 0.04% to 23.67% of mixed liquor suspended solid (MLSS) in the acclimated sludge, and the COD of the PO saponification wastewater was also decreased in the fermentation. This work would provide an effective solution for the utilization of PO saponification wastewater residual sludge.",International journal of biological macromolecules,2017,None,10.1016/j.ijbiomac.2017.01.106,1,Undefined,Wastewater sludge,Polyhydroxyalkanoate,,Undefined
34619589,Bioelectricity production and shortcut nitrogen removal by microalgal-bacterial consortia using membrane photosynthetic microbial fuel cell.,"Membrane photosynthetic microbial fuel cell (MPMFC) utilizes O<sub>2</sub>, NO<sub>3</sub><sup>-</sup> and NO<sub>2</sub><sup>-</sup> as cathodic electron acceptors, enabling simultaneous treatment of nitrogen, CO<sub>2</sub> and organic carbon in the cathode compartment. In this work, development of a novel cathodic process with in situ nitritation via microalgal photosynthesis during the light period is reported for achieving shortcut nitrogen removal (SNR) from ammonium-rich wastewater. Moreover, a tubular low-cost ceramic membrane was used to separate and recycle the microalgal-bacterial biomass to the cathode compartment during the continuous operation. The influence of NH<sub>4</sub><sup>+</sup> concentration and ratio of chemical oxygen demand to total nitrogen on the MPMFC performance was examined. Denitritation under dark and anoxic conditions occurred due to denitrifying bacteria (DNB) subsequent to nitritation under light and aerobic conditions by ammonia-oxidizing bacteria (AOB) in the consortia. Final concentrations of NH<sub>4</sub><sup>+</sup> and NO<sub>2</sub><sup>-</sup> in the effluent of 0.10 mg NH<sub>4</sub><sup>+</sup>-L<sup>-1</sup> and 0.02 mg NO<sub>2</sub><sup>-</sup>-L<sup>-1</sup>, respectively, were obtained using MPMFC which resulted in a nitrogen removal efficiency of 99 ± 0.5%. The maximum electricity production achieved using the MPMFC was 56 ± 0.1 mA. This study demonstrated that combining microalgal photosynthesis, nitritation and denitritation in the cathode compartment of MPMFC is advantageous for avoiding the cost due to external aeration and organic carbon source necessary for ammonium removal as well as utilization of NO<sub>2</sub><sup>-</sup> or NO<sub>3</sub><sup>-</sup> as an electron acceptor.",Journal of environmental management,2022,None,10.1016/j.jenvman.2021.113871,1,Undefined,Wastewater sludge,Electricity,,Undefined
20854983,Potent antilisterial cell-free supernatants produced by complex red-smear cheese microbial consortia.,"The microbial surface ripening consortia of 49 soft cheeses were investigated with respect to their inhibition of Listeria monocytogenes. When L. monocytogenes EGDe (serovar 1/2a) was cultivated in cell-free supernatants obtained from consortia grown for 8 h in liquid medium, a strong bactericidal activity was observed in several cases. The cell-free supernatants of 2 of these consortia (I and II) reduced an initial L. monocytogenes inoculum of 5 × 10(7) cfu/mL to zero after 24 h of incubation. No inhibitory substances could be washed off the complex consortia when incubated for a 10-min period. A taxonomical analysis of the antilisterial consortia I and II using Fourier transform infrared spectroscopy yielded a considerable species diversity, with lactic acid bacteria increasing strongly during the 8-h cultivation. Therefore, 23 lactic acid bacteria bacteriocin genes were assayed using specific PCR primers, identifying 3 bacteriocin genes in both microbial communities. However, no transcription of these genes was found on cheese surfaces or in consortia propagated in liquid culture. Individual lactic acid bacteria isolates of consortia I and II displayed no or only weak inhibition of L. monocytogenes on solid medium. The complex cell-free supernatants I and II, in contrast, exhibited an unusually broad inhibitory spectrum, killing L. monocytogenes ssp., Bacillus spp., Staphylococcus aureus, as well as gram-negative bacteria such as Escherichia coli DH5α and Salmonella enterica serovar Typhimurium. Inhibition could not be abolished by heating to 100°C or by proteinase K treatment. Initial purification of an inhibitory substance from consortium I by solid-phase extraction and HPLC indicates the presence of rather small, extremely stable compounds, which, most probably, are not bacteriocins.",Journal of dairy science,2010,None,10.3168/jds.2010-3244,1,Undefined,Glycerol,Antilisterial compounds,,Undefined
