PM_ID,Title,Abstract,Journal,Year,PMC_ID,DOI,Classification,Community type,Substrate,Product,Organisms,Family
32927315,Biosynthesized iron sulfide nanoparticles by mixed consortia for enhanced extracellular electron transfer in a microbial fuel cell.,"The bioanode of mixed consortia was for the first time used to in-situ synthesize iron sulfide nanoparticles in a microbial fuel cell (MFC) over a long-term period (46 days). These poorly crystalline nanoparticles with an average size of 29.97 ± 7.1 nm, comprising of FeS and FeS<sub>2</sub>, significantly promoted extracellular electron transfer and thus the electricity generation of the MFC. A maximum power density of 519.00 mW/m<sup>2</sup> was obtained from the MFC, which was 1.92 times as high as that of the control. The cell viability was promoted by a small amount of iron sulfide nanoparticles but inhibited by the thick nanoparticle ""shell"" covered on the bacterial cells. Some electroactive and sulfur reducing bacteria (eg. Enterobacteriaceae, Desulfovibrio, and Geobacter) were specifically enriched on the anode. This study provides a novel insight for improving the performance of bioelectrochemical systems through in-situ sustainable nanomaterials biofabrication by mixed consortia.",Bioresource technology,2020,None,10.1016/j.biortech.2020.124095,1,Undefined,Glucose,Electricity,,Undefined
30834245,"Bioconversion of Raw Glycerol From Waste Cooking-Oil-Based Biodiesel Production to 1,3-Propanediol and Lactate by a Microbial Consortium.","Waste cooking oil (WCO) is a sustainable alternative to raw vegetable oils and fats for biodiesel production considering both environmental and economic benefits. Raw glycerol from WCO-based biodiesel production (GWCO) is difficult to utilize via biological method, as multiple toxic impurities have inhibitory effects on microbial growth especially for pure cultures. In this work, four microbial consortia were selected from activated sludge by 30 serial transfers under different conditions. The obtained consortia exhibited lower diversity and species difference with the transfers. The consortium LS30 exhibited unique advantages for bioconversion of GWCO to 1,3-propanediol (1,3-PDO) and lactate (LA). Moreover, the fermentation could be performed economically under microaerobic and non-sterile conditions. The consortium consisted of 57.97% <i>Enterobacter</i> and 39.25% <i>Escherichia</i> could effectively convert 60 g/L GWCO to 1,3-PDO and LA in batch fermentation. In addition, this consortium exhibited better tolerance to fatty acid-derived crude glycerol (100 g/L), which demonstrated that specific toxic impurities in GWCO did pose a great challenge to microbial growth and metabolism. In fed batch fermentation, 27.77 g/L 1,3-PDO and 14.68 g/L LA were achieved. Compared with the consortium, a long lag phase in cell growth associated with a decreased glycerol consumption was observed in four single-strain fermentations. Furthermore, neither the consortium DL38 with excellent glycerol tolerance nor consortium C2-2M with high yield of 1,3-PDO could effectively transform GWCO into valuable products. The results demonstrated that the selected microbial consortium has the advanced adaptability to the toxic impurities in GWCO compared with other reported consortia and isolated single strain. This process can contribute to added-value use of GWCO.",Frontiers in bioengineering and biotechnology,2019,6387908,10.3389/fbioe.2019.00014,1,Undefined,Glycerol,"1,3-Propanediol, Lactate",,Undefined
17969638,Production and application of a novel bioflocculant by multiple-microorganism consortia using brewery wastewater as carbon source.,"The flocculating activity of a novel bioflocculant MMF1 produced by multiple-microorganism consortia MM1 was investigated. MM1 was composed of strain BAFRT4 identified as Staphylococcus sp. and strain CYGS1 identified as Pseudomonas sp. The flocculating activity of MMF1 isolated from the screening medium was 82.9%, which is remarkably higher than that of the bioflocculant produced by either of the strains under the same condition. Brewery wastewater was also used as the carbon source for MM1, and the cost-effective production medium for MM1 mainly comprised 1.0 L brewery water (chemical oxygen demand (COD) 5000 mg/L), 0.5 g/L urea, 0.5 g/L yeast extract, and 0.2 g/L (NH4)2SO4. The optimal conditions for the production of MMF1 was inoculum size 2%, initial pH 6.0, cultivating temperature 30 degrees C, and shaking speed 160 r/min, under which the flocculating activity of the MMF1 reached 96.8%. Fifteen grams of purified bioflocculant could be recovered from 1.0 L of fermentation broth. MMF1 was identified as a macromolecular substance containing both protein and polysaccharide. It showed good flocculating performance in treating indigotin printing and dyeing wastewater, and the maximal removal efficiencies of COD and chroma were 79.2% and 86.5%, respectively.",Journal of environmental sciences (China),2007,None,10.1016/s1001-0742(07)60112-0,1,Undefined,Wastewater sludge,Bioflocculant,,Undefined
25648981,Cellulosic ethanol production by natural bacterial consortia is enhanced by Pseudoxanthomonas taiwanensis.,"Natural bacterial consortia are considered a promising solution for one-step production of ethanol from lignocellulose because of their adaptation to a wide range of natural lignocellulosic substrates and their capacity for efficient cellulose degradation. However, their low ethanol conversion efficiency has greatly limited the development and application of natural bacterial consortia.",Biotechnology for biofuels,2015,4308921,10.1186/s13068-014-0186-7,1,Undefined,Lignocellulose,Ethanol,Pseudoxanthomonas taiwanensis,"Xanthomonadaceae, Undefined"
17910366,Hydrogen production by anaerobic microbial communities exposed to repeated heat treatments.,"Biological hydrogen production by anaerobic mixed communities was studied in laboratory-scale bioreactors using sucrose as the substrate. A bioreactor in which a fraction of the return sludge was exposed to repeated heat treatments performed better than a control bioreactor without repeated heat treatment of return sludge and produced a yield of 2.15 moles of hydrogen per mole of sucrose, with 50% hydrogen in the biogas. Terminal restriction fragment length polymorphism analysis showed that two different Clostridium groups (comprised of one or more species) were dominant during hydrogen production. The relative abundance of two other non-Clostridium groups increased during periods of decreased hydrogen production. The first group consisted of Bifidobacterium thermophilum, and the second group included one or more of Bacillus, Melissococcus, Spirochaeta, and Spiroplasma spp.",Water environment research : a research publication of the Water Environment Federation,2007,None,10.2175/106143007x175762,1,Undefined,Sucrose,Hydrogen,,Undefined
28390276,Photosynthetic hydrogen production by alginate immobilized bacterial consortium.,"Photosynthetic hydrogen production from organic wastewaters using immobilized mixed culture with photosynthetic bacteria (PSB) was studied. A PSB consortium was immobilized by alginate matrix to form granules. The so-yielded granules exhibited minimal diffusional resistances to substrates and to illumination penetration but still produced more hydrogen from synthetic wastewater than the free cells at identical experimental conditions. Optimal granule size, cell loadings, and cell ages for granules and the minimum substrate concentration and maximum illumination intensity requited to maximize hydrogen production were studied. The applied alginate matrix can provide shield to embedded cells from external challenges, likely the produced proton gradients from the surroundings.",Bioresource technology,2017,None,10.1016/j.biortech.2017.03.171,1,Undefined,"Wastewater sludge, Light",Hydrogen,,Undefined
30060435,Kinetics and microbial community analysis for hydrogen production using raw grass inoculated with different pretreated mixed culture.,"In this study, five pretreatment methods (heat shock, acid, base, aeration and gamma radiation) were applied for enriching hydrogen producers from anaerobically digested sludge, aiming to compare their hydrogen fermentation performance using raw ryegrass as substrate. Results showed that various pretreatment methods caused great variations on grass hydrogen fermentation performance. Acid pretreatment was most efficient compared with other tested pretreatment methods, with relevant hydrogen yield of 64.4mL/g dry grass and organics removal of 31.4%. Kinetics results showed that the first-order kinetic model fitted hydrogen evolution better than the modified Gompertz model. Microbiological analysis showed that various pretreatment methods caused great variations on microbial activity and microbial community composition. Clostridium and Enterococcus were two dominant genera, while relative abundances of these two genera varied greatly for different pretreated samples. Difference in microbial activity and microbial community distribution induced by the pretreatment methods might directly cause different ryegrass fermentation performance.",Bioresource technology,2018,None,10.1016/j.biortech.2017.09.041,1,Undefined,Wastewater sludge,Hydrogen,,Undefined
30420331,Enriched microbial consortia for dark fermentation of sugarcane vinasse towards value-added short-chain organic acids and alcohol production.,"The role of sugarcane vinasse as a nutrient source and the impacts of different inoculum pretreatment methods (acid-thermal and thermal treatment) were assessed in acidogenic systems aiming to produce value-added short-chain organic acids (SCOA) and alcohols. In-depth microbiome characterization was also conducted by high-throughput sequencing of the 16S rRNA gene using the Miseq Illumina platform. SCOA production was 47.3 % higher in vinasse-fed reactors, with isobutyric (up to 10.3 g L<sup>-1</sup>) and butyric (up to 10.6 g L<sup>-1</sup>) acids as the primary metabolites most likely resulting from lactate conversion. Ethanol comprised the main product from solventogenic pathways in all conditions, with values ranging between 2.7 and 5.2 g L<sup>-1</sup>, whereas no butanol was detected. Microbial analyses revealed high relative abundance values for the Clostridium, Lactobacillus, Bacillus and Ruminococcus genera, with the predominance of the Clostridium genus (17%) in acid-thermal treatment reactors and the Lactobacillus genus (37%) in thermal treatment reactors. Overall, vinasse proved to be a suitable substrate for value-added SCOA production, which characterizes a potential management approach to this wastewater stream. In this sense, the biochemical production of butyrate from vinasse could diversify the product portfolio of sugarcane biorefineries, also minimizing bioenergy losses by converting residual carbon fractions.",Journal of bioscience and bioengineering,2019,None,10.1016/j.jbiosc.2018.10.008,1,Undefined,Lignocellulose,"Ethanol, SCOA",,Undefined
15558274,H2-producing bacterial communities from a heat-treated soil inoculum.,"Hydrogen gas (approximately 60% H(2)) was produced in a continuous flow bioreactor inoculated with heat-treated soil, and fed synthetic wastewater containing glucose (9.5 g l(-1)). The pH in the bioreactor was maintained at 5.5 to inhibit consumption of H(2) by methanogens. The objective of this study was to characterize bacterial communities in the reactor operated under two different hydraulic retention times (HRTs of 30-h and 10-h) and temperatures (30 degrees C and 37 degrees C). At 30-h HRT, the H(2) production rate was 80 ml h(-1) and yield was 0.91 mol H(2)/mol glucose. At 10-h HRT, the H(2) production rate was more than 5 times higher at 436 ml h(-1), and yield was 1.61 mol H(2)/mol glucose. Samples were removed from the reactor under steady-state conditions for PCR-based detection of bacterial populations by ribosomal intergenic spacer analysis (RISA). Populations detected at 30-h HRT were more diverse than at 10-h HRT and included representatives of Bacillaceae, Clostridiaceae, and Enterobacteriaceae. At 10-h HRT, only Clostridiaceae were detected. When the temperature of the 10-h HRT reactor was increased from 30 degrees C to 37 degrees C, the steady-state H(2) production rate increased slightly to 463 ml h(-1) and yield was 1.8 mol H(2)/mol glucose. Compared to 30 degrees C, RISA fingerprints at 37 degrees C from the 10-h HRT bioreactor exhibited a clear shift from populations related to Clostridium acidisoli (subcluster Ic) to populations related to Clostridium acetobutylicum (subcluster Ib).",Applied microbiology and biotechnology,2004,None,10.1007/s00253-004-1666-7,1,Undefined,Wastewater sludge,Hydrogen,,Undefined
26547811,Semi-continuous methane production from undiluted brown algae using a halophilic marine microbial community.,"Acclimated marine sediment-derived culture was used for semi-continuous methane production from materials equivalent to raw brown algae, without dilution of salinity and without nutrient supply, under 3 consecutive conditions of varying organic loading rates (OLRs) and hydraulic retention time (HRT). Methane production was stable at 2.0gVS/kg/day (39-day HRT); however, it became unstable at 2.9gVS/kg/day (28-day HRT) due to acetate and propionate accumulation. OLR subsequently decreased to 1.7gVS/kg/day (46-day HRT), stabilizing methane production beyond steady state. Methane yield was above 300mL/g VS at all OLRs. These results indicated that the acclimated marine sediment culture was able to produce methane semi-continuously from raw brown algae without dilution and nutrient supply under steady state. Microbial community analysis suggested that hydrogenotrophic methanogens predominated among archaea during unstable methane production, implying a partial shift of the methanogenic pathway from acetoclastic methanogenesis to acetate oxidation. ",Bioresource technology,2016,None,10.1016/j.biortech.2015.10.090,1,Undefined,Organic waste,Methane,,Undefined
31442834,Antibiotic fermentation residue for biohydrogen production using different pretreated cultures: Performance evaluation and microbial community analysis.,"Antibiotic fermentation residue produced from pharmaceutical plants has been listed as a ""Hazardous Waste"", however it contains various substrates which can be used for biofuel production. In this study, the possibility of biohydrogen production from antibiotic fermentation residue was evaluated, the process efficiency and microbial community dynamics with five different inoculum pretreatments (alkaline, γ-radiation, heat-shock, aeration and acid) were assessed. Results showed that alkaline pretreatment was most efficient for hydrogen fermentation, and the hydrogen yield, volatile solids (VS) removal and maximal hydrogen production rate reached 17.8 mL/g-VS<sub>added</sub>, 17.8% and 3.79 mL/h, respectively. Different inoculum pretreatments led to a obvious variation in the fermentation pathway and microbial community structure. The highest content of hydrogen-producing bacteria, especially Clostridium, essentially contributed to the highest hydrogen fermentation efficiency for the system with alkaline pretreatment. This investigation suggested that antibiotic fermentation residue is a potential feedstock for hydrogen production through dark fermentation.",Bioresource technology,2019,None,10.1016/j.biortech.2019.122012,1,Undefined,Antibiotic fermentation residue,Hydrogen,,Undefined
11762604,Microbial community in anaerobic hydrogen-producing microflora enriched from sludge compost.,"Hydrogen production by thermophilic anaerobic microflora enriched from sludge compost was studied by using an artificial medium containing cellulose powder. Hydrogen gas was evolved with the formation of acetate, ethanol, and butyrate by decomposition of the cellulose powder. The hydrogen production yield was 2.0 mol/mol-hexose by either batch or chemostat cultivation. A medium that did not contain peptone demonstrated a lower hydrogen production yield of 1.0 mol/mol-hexose with less formation of butyrate. The microbial community in the microflora was investigated through isolation of the microorganisms by both plating and denaturing gradient gel electrophoresis (DGGE) of the' PCR-amplified V3 region of 16S rDNA. Sixty-eight microorganisms were isolated from the microflora and classified into nine distinct groups by genetic fingerprinting of the PCR-DGGE or by a random amplified polymorphic DNA analysis and determination of the partial sequence of 16S rDNA. Most of the isolates belonged to the cluster of the thermophilic Clostridium/Bacillus subphylum of low G+C gram-positive bacteria. Product formation by most of the isolated strains corresponded to that produced by the microflora. Thermoanaerobacterium thermosaccharolyticium was isolated in the enrichment culture with or without added peptone. and was detected with strong intensity by PCR-DGGE. Two other thermophilic cellulolytic microorganisms, Clostridium thermocellum and Clostridium cellulosi, were also detected by PCR-DGGE, although they could not be isolated. These findings imply that hydrogen production from cellulose by microflora is performed by a consortium of several species of microorganisms.",Applied microbiology and biotechnology,2001,None,10.1007/s002530100806,1,Undefined,Sludge compost,Hydrogen,,Undefined
33329449,Function-Driven Design of Lactic Acid Bacteria Co-cultures to Produce New Fermented Food Associating Milk and Lupin.,"Designing bacterial co-cultures adapted to ferment mixes of vegetal and animal resources for food diversification and sustainability is becoming a challenge. Among bacteria used in food fermentation, lactic acid bacteria (LAB) are good candidates, as they are used as starter or adjunct in numerous fermented foods, where they allow preservation, enhanced digestibility, and improved flavor. We developed here a strategy to design LAB co-cultures able to ferment a new food made of bovine milk and lupin flour, consisting in: (i) <i>in silico</i> preselection of LAB species for targeted carbohydrate degradation; (ii) <i>in vitro</i> screening of 97 strains of the selected species for their ability to ferment carbohydrates and hydrolyze proteins from milk and lupin and clustering strains that displayed similar phenotypes; and (iii) assembling strains randomly sampled from clusters that showed complementary phenotypes. The designed co-cultures successfully expressed the targeted traits i.e., hydrolyzed proteins and degraded raffinose family oligosaccharides of lupin and lactose of milk in a large range of concentrations. They also reduced an off-flavor-generating volatile, hexanal, and produced various desirable flavor compounds. Most of the strains in co-cultures achieved higher cell counts than in monoculture, suggesting positive interactions. This work opens new avenues for the development of innovative fermented food products based on functionally complementary strains in the world-wide context of diet diversification.",Frontiers in microbiology,2020,7717992,10.3389/fmicb.2020.584163,1,Undefined,"Bovine milk, Lupin flour",Fermented food product,,Undefined
21171663,Current production by bacterial communities in microbial fuel cells enriched from wastewater sludge with different electron donors.,"Electricity production by bacterial communities enriched from wastewater sludge with lactate, succinate, N-acetyl-D-glucosamine (NAG), acetate, formate, and uridine were monitored in dual-chamber microbial fuel cells (MFCs). Stable electricity production was observed after 300 h for communities enriched from lactate, acetate, and formate, while communities enriched with succinate, NAG, and uridine stabilized only after 700 h. The average peak current densities and maximum power densities generated from bacterial consortia were significantly higher than those generated from pure cultures of Shewanella oneidensis MR-1. Microbial assemblages were analyzed by DGGE, and planktonic and anode-attached bacterial communities varied as a function of electron donors: Firmicutes, β-Proteobacteria, and Bacteroidetes dominated the planktonic bacterial communities while anode-attached communities consisted mainly of δ-Proteobacteria, β-Proteobacteria, and Firmicutes. Similar bacterial populations were enriched in MFCs fed with lactate, NAG, and uridine and with succinate, acetate, and formate. Cross-feeding experiments with different fuels indicated that enriched microbial consortia were able to utilize a variety of fuel sources and displayed considerable stability, efficiency, and robustness of power generation in comparison to pure cultures. In addition, characterizations of cultivated Shewanella strains suggested that DGGE analysis likely missed active members of exoelectrogenic populations.",Environmental science & technology,2011,None,10.1021/es102645v,1,Undefined,Wastewater sludge,Electricity,,Undefined
21216592,Performance and microbial community analysis of two-stage process with extreme thermophilic hydrogen and thermophilic methane production from hydrolysate in UASB reactors.,"The two-stage process for extreme thermophilic hydrogen and thermophilic methane production from wheat straw hydrolysate was investigated in up-flow anaerobic sludge bed (UASB) reactors. Specific hydrogen and methane yields of 89 ml-H(2)/g-VS (190 ml-H(2)/g-sugars) and 307 ml-CH(4)/g-VS, respectively were achieved simultaneously with the overall VS removal efficiency of 81% by operating with total hydraulic retention time (HRT) of 4 days . The energy conversion efficiency was dramatically increased from only 7.5% in the hydrogen stage to 87.5% of the potential energy from hydrolysate, corresponding to total energy of 13.4 kJ/g-VS. Dominant hydrogen-producing bacteria in the H(2)-UASB reactor were Thermoanaerobacter wiegelii, Caldanaerobacter subteraneus, and Caloramator fervidus. Meanwhile, the CH(4)-UASB reactor was dominated with methanogens of Methanosarcina mazei and Methanothermobacter defluvii. The results from this study suggest the two stage anaerobic process can be effectively used for energy recovery and for stabilization of hydrolysate at anaerobic conditions.",Bioresource technology,2011,None,10.1016/j.biortech.2010.12.009,1,Undefined,Lignocellulose,"Hydrogen, Methane",,Undefined
22864434,Effects of heat treatment on microbial communities of granular sludge for biological hydrogen production.,"Dark fermentation shares many features with anaerobic digestion with the exception that to maximize hydrogen production, methanogens and hydrogen-consuming bacteria should be inhibited. Heat treatment is widely applied as an inoculum pre-treatment due to its effectiveness in inhibiting methanogenic microflora but it may not exclusively select for hydrogen-producing bacteria. This work evaluated the effects of heat treatment on microbial viability and structure of anaerobic granular sludge. Heat treatment was carried out on granular sludge at 100 °C with four residence times (0.5, 1, 2 and 4 h). Hydrogen production of treated sludges was studied from glucose by means of batch test at different pH values. Results indicated that each heat treatment strongly influenced the granular sludge resulting in microbial communities having different hydrogen productions. The highest hydrogen yields (2.14 moles of hydrogen per mole of glucose) were obtained at pH 5.5 using the sludge treated for 4 h characterized by the lowest CFU concentration (2.3 × 10(3)CFU/g sludge). This study demonstrated that heat treatment should be carefully defined according to the structure of the sludge microbial community, allowing the selection of highly efficient hydrogen-producing microbes.",Water science and technology : a journal of the International Association on Water Pollution Research,2012,None,10.2166/wst.2012.336,1,Undefined,Organic waste,Hydrogen,,Undefined
