PM_ID,Title,Abstract,Journal,Year,PMC_ID,DOI,Classification,Community type,Substrate,Product,Organisms,Family
34348711,Development and optimization of a microbial co-culture system for heterologous indigo biosynthesis.,"Indigo is a color molecule with a long history of being used as a textile dye. The conventional production methods are facing increasing economy, sustainability and environmental challenges. Therefore, developing a green synthesis method converting renewable feedstocks to indigo using engineered microbes is of great research and application interest. However, the efficiency of the indigo microbial biosynthesis is still low and needs to be improved by proper metabolic engineering strategies.",Microbial cell factories,2021,8336371,10.1186/s12934-021-01636-w,1,Defined,Glycerol,Indigo,Escherichia coli,Enterobacteriaceae
34656153,Comprehensive evaluation for the one-pot biosynthesis of butyl acetate by using microbial mono- and co-cultures.,"Butyl acetate has shown wide applications in food, cosmetics, medicine, and biofuel sectors. These short-chain fatty acid esters can be produced by either chemical or biological synthetic process with corresponding alcohols and acids. Currently, biosynthesis of short chain fatty acid esters, such as butyl butyrate, through microbial fermentation systems has been achieved; however, few studies regarding biosynthesis of butyl acetate were reported.",Biotechnology for biofuels,2021,8520270,10.1186/s13068-021-02053-2,1,Defined,Glucose,Butyl acetate,"Clostridium acetobutylicum, Actinobacillus succinogenes","Clostridiaceae, Pasteurellaceae"
22015987,Synthetic Escherichia coli consortia engineered for syntrophy demonstrate enhanced biomass productivity.,"Synthetic Escherichia coli consortia engineered for syntrophy demonstrated enhanced biomass productivity relative to monocultures. Binary consortia were designed to mimic a ubiquitous, naturally occurring ecological template of primary productivity supported by secondary consumption. The synthetic consortia replicated this evolution-proven strategy by combining a glucose positive E. coli strain, which served as the system's primary producer, with a glucose negative E. coli strain which consumed metabolic byproducts from the primary producer. The engineered consortia utilized strategic division of labor to simultaneously optimize multiple tasks enhancing overall culture performance. Consortial interactions resulted in the emergent property of enhanced system biomass productivity which was demonstrated with three distinct culturing systems: batch, chemostat and biofilm growth. Glucose-based biomass productivity increased by ∼15, 20 and 50% compared to appropriate monoculture controls for these three culturing systems, respectively. Interestingly, the consortial interactions also produced biofilms with predictable, self-assembling, laminated microstructures. This study establishes a metabolic engineering paradigm which can be easily adapted to existing E. coli based bioprocesses to improve productivity based on a robust ecological theme.",Journal of biotechnology,2012,3549274,10.1016/j.jbiotec.2011.10.001,1,Defined,Glucose,Biomass,Escherichia coli,Enterobacteriaceae
35538542,De novo biosynthesis of p-coumaric acid and caffeic acid from carboxymethyl-cellulose by microbial co-culture strategy.,"Aromatic compounds, such as p-coumaric acid (p-CA) and caffeic acid, are secondary metabolites of various plants, and are widely used in diet and industry for their biological activities. In addition to expensive and unsustainable methods of plant extraction and chemical synthesis, the strategy for heterologous synthesis of aromatic compounds in microorganisms has received much attention. As the most abundant renewable resource in the world, lignocellulose is an economical and environmentally friendly alternative to edible, high-cost carbon sources such as glucose.",Microbial cell factories,2022,9088102,10.1186/s12934-022-01805-5,1,Defined,Lignocellulose,"P-coumaric acid, Caffeic acid",Saccharomyces cerevisiae,Saccharomycetaceae
34370382,Adaptive laboratory evolution of microbial co-cultures for improved metabolite secretion.,"Adaptive laboratory evolution has proven highly effective for obtaining microorganisms with enhanced capabilities. Yet, this method is inherently restricted to the traits that are positively linked to cell fitness, such as nutrient utilization. Here, we introduce coevolution of obligatory mutualistic communities for improving secretion of fitness-costly metabolites through natural selection. In this strategy, metabolic cross-feeding connects secretion of the target metabolite, despite its cost to the secretor, to the survival and proliferation of the entire community. We thus co-evolved wild-type lactic acid bacteria and engineered auxotrophic Saccharomyces cerevisiae in a synthetic growth medium leading to bacterial isolates with enhanced secretion of two B-group vitamins, viz., riboflavin and folate. The increased production was specific to the targeted vitamin, and evident also in milk, a more complex nutrient environment that naturally contains vitamins. Genomic, proteomic and metabolomic analyses of the evolved lactic acid bacteria, in combination with flux balance analysis, showed altered metabolic regulation towards increased supply of the vitamin precursors. Together, our findings demonstrate how microbial metabolism adapts to mutualistic lifestyle through enhanced metabolite exchange.",Molecular systems biology,2021,8351387,10.15252/msb.202010189,1,Defined,Amino acid medium,Vitamins,"Lactobacillus plantarum, Saccharomyces cerevisiae","Saccharomycetaceae, Lactobacillaceae"
12619667,Extracellular acidic polysaccharide production by a two-membered bacterial coculture.,"A two-membered coculture of strains KYM-7 and KYM-8, identified as Cellulomonas cellulans and Agrobacterium tumefaciens, respectively, produced a large amount of an extracellular polysaccharide, designated APK-78, from starch. Each strain in pure culture produced only very little amount of polysaccharide from starch; the coexistence of the two strains from the early stage of cultivation was indispensable for a large amount of polysaccharide to be produced. The polysaccharide APK-78 was acidic and composed of glucose, galactose, succinic acid, and pyruvic acid with a molar ratio of 8.1:1.0:1.7:1.0, indicating that it is a succinoglycan type of polysaccharide.","Bioscience, biotechnology, and biochemistry",2003,None,10.1271/bbb.67.8,1,Defined,Starch,Polysaccharide,"Cellulomonas cellulans, Agrobacterium tumefaciens","Promicromonosporaceae, Rhizobiaceae"
32863734,Metabolic modeling of bacterial co-culture systems predicts enhanced carbon monoxide-to-butyrate conversion compared to monoculture systems.,"We used metabolic modeling to computationally investigate the potential of bacterial coculture system designs for CO conversion to the platform chemical butyrate. By taking advantage of the native capabilities of wild-type strains, we developed two anaerobic coculture designs by combining <i>Clostridium autoethanogenum</i> for CO-to-acetate conversion with bacterial strains that offer high acetate-to-butyrate conversion capabilities: the environmental bacterium the human gut bacterium<i>Eubacterium rectale</i>. When grown in continuous stirred tank reactor on a 70/0/30 CO/H<sub>2</sub>/N<sub>2</sub> gas mixture, the C. autoethanogenum-<i>C Kluyveri</i> co-culture was predicted to offer no mprovement in butyrate volumetric productivity compared to an engineered <i>C. autoethanogenum</i> monoculture despite utilizing vinyl acetate as a secondary carbon source for <i>C. kluyveri</i> growth enhancement. A coculture consisting of <i>C. autoethanogenum</i> and <i>C. kluyveri</i> engineered in silico to eliminate hexanoate synthesis was predicted to enhance both butyrate productivity and titer. The <i>C. autoethanogenum-E. rectale</i> coculture offered similar improvements in butyrate productivity without the need for metabolic engineering when glucose was provided as a secondary carbon source to enhance <i>E. rectale</i> growth. A bubble column model developed to assess the potential for large-scale butyrate production of the <i>C. autoethanogenum-E. rectale</i> design predicted that a 40/30/30 CO/H<sub>2</sub>/N<sub>2</sub> gas mixture and a 5 m column length would be preferred to enhance <i>C. autoethanogenum</i> growth and counteract CO inhibitory effects on <i>E. rectale.</i>",Biochemical engineering journal,2019,7449128,10.1016/j.bej.2019.107338,1,Defined,CO,Butyrate,"Clostridium autoethanogenum, Eubacterium rectale, Clostridium kluyveri","Clostridiaceae, Eubacteriaceae"
25470793,Rationally engineered synthetic coculture for improved biomass and product formation.,"In microbial ecosystems, bacteria are dependent on dynamic interspecific interactions related to carbon and energy flow. Substrates and end-metabolites are rapidly converted to other compounds, which protects the community from high concentrations of inhibitory molecules. In biotechnological applications, pure cultures are preferred because of the more straight-forward metabolic engineering and bioprocess control. However, the accumulation of unwanted side products can limit the cell growth and process efficiency. In this study, a rationally engineered coculture with a carbon channeling system was constructed using two well-characterized model strains Escherichia coli K12 and Acinetobacter baylyi ADP1. The directed carbon flow resulted in efficient acetate removal, and the coculture showed symbiotic nature in terms of substrate utilization and growth. Recombinant protein production was used as a proof-of-principle example to demonstrate the coculture utility and the effects on product formation. As a result, the biomass and recombinant protein titers of E. coli were enhanced in both minimal and rich medium simple batch cocultures. Finally, harnessing both the strains to the production resulted in enhanced recombinant protein titers. The study demonstrates the potential of rationally engineered cocultures for synthetic biology applications.",PloS one,2014,4254613,10.1371/journal.pone.0113786,1,Defined,Glucose,Recombinant protein,"Escherichia coli, Acinetobacter baylyi","Enterobacteriaceae, Moraxellaceae"
30390509,"Shaping microbial consortia in coupling glycerol fermentation and carboxylate chain elongation for Co-production of 1,3-propanediol and caproate: Pathways and mechanisms.","Glycerol is presently being generated in surplus with the rapid growth of the biodiesel industry and seeks ways to be upcycled, rather than to be treated with costs. Glycerol for the co-production of 1,3-propanediol (1,3-PDO) and caproate has a great prospect. Yet, its technical difficulty lies in the enhancement of caproate productivity, which requires the presence of ethanol as a co-substrate and necessitates the co-existence of functional microbes for glycerol fermentation and chain elongation. This study successfully achieved 6.38 mM C 1,3-PDO d<sup>-1</sup> and 2.95 mM C caproate d<sup>-1</sup> in a 2-L mixed-cultured semi-continuous fermenter with a glycerol-ethanol-acetate stoichiometric ratio of 4:3:1. Such conversions were mainly facilitated by a microbial community of Eubacterium limosum, Clostridium kluyveri and Massilibacterium senegalense. With such a synergistic microbiome, the co-production of 1,3-PDO and caproate was achieved from glycerol without ethanol addition. Based on metagenomics, E. limosum is capable of converting glycerol to 1,3-PDO, ethanol and H<sub>2</sub>, and also redirecting the electron potential of H<sub>2</sub> into acetate via the Wood-Ljungdahl pathway, which is then used for chain elongation. C. kluyveri worked synergistically with E. limosum by consuming ethanol and acetate for caproate production. M. senegalense encodes for ethanol oxidation to acetate and butyrate, facilitating the generation of these intermediates for C. kluyveri elongation to caproate. During the transition between fermentation and elongation, an unexpected observation of poly-β-hydroxybutyrate (PHB) formation and reutilization by M. senegalense may be associated with butyrate formation for further caproate generation. The knowledge gleaned from the substrate constitute, microbial consortium and their synergetic metabolism demonstrates a resource upgrade potential for crude glycerol or glycerol-containing wastewater generated from the biodiesel industry.",Water research,2019,None,10.1016/j.watres.2018.10.063,1,Defined,Glycerol,"1,3-Propanediol, Caproate","Eubacterium limosum, Clostridium kluyveri, Massilibacterium senegalense","Clostridiaceae, Eubacteriaceae, Bacillaceae"
35730952,Engineering <i>Pseudomonas putida</i> To Produce Rhamnolipid Biosurfactants for Promoting Phenanthrene Biodegradation by a Two-Species Microbial Consortium.,"Polycyclic aromatic hydrocarbons (PAHs) are a group of organic contaminants that pose a significant environmental hazard. Phenanthrene is one of the model compounds for the study of biodegradation of PAHs. However, the biodegradation of phenanthrene is often limited by its low water solubility and dissolution rate. To overcome this limitation, we engineered a strain of Pseudomonas putida to produce rhamnolipid biosurfactants and thereby promote phenanthrene biodegradation by an engineered strain of Escherichia coli constructed previously in our lab. The E. coli-P. putida two-species consortium exhibited a synergistic effect of these two distinct organisms in degrading phenanthrene, resulting in an increase from 61.15 to 73.86% of the degradation ratio of 100 mg/L phenanthrene within 7 days. After additional optimization of the degradation conditions, the phenanthrene degradation ratio was improved to 85.73%. <b>IMPORTANCE</b> Polycyclic aromatic hydrocarbons (PAHs), which are recalcitrant, carcinogenic, and tend to bioaccumulate, are widespread and persistent environmental pollutants. Based on these characteristics, the U.S. Environmental Protection Agency has listed PAHs as priority contaminants. Although there are many methods to treat PAH pollution, these methods are mostly limited by the poor water solubility of PAHs, which is especially true for the biodegradation process. Recent evidence of PAH-contaminated sites suffering from increasingly severe impact has emerged. As a result, the need to degrade PAHs is becoming urgent. The significance of our study lies in the development of nonpathogenic strains of biosurfactant-producing Pseudomonas aeruginosa for promoting the degradation of phenanthrene by engineered Escherichia coli.",Microbiology spectrum,2022,9431653,10.1128/spectrum.00910-22,1,Defined,"Phenanthrene, Glycerol",Biosurfactants,"Pseudomonas putida, Escherichia coli","Pseudomonadaceae, Enterobacteriaceae"
36270363,Model-aided targeted volatile fatty acid production from food waste using a defined co-culture microbial community.,"The production of volatile fatty acids (VFA) is gaining momentum due to their central role in the emerging carboxylate platform. Particularly, the production of the longest VFA (from butyrate to caproate) is desired due to their increased economic value and easier downstream processing. While the use of undefined microbial cultures is usually preferred with organic waste streams, the use of defined microbial co-culture processes could tackle some of their drawbacks such as poor control over the process outcome, which often leads to low selectivity for the desired products. However, the extensive experimentation needed to design a co-culture system hinders the use of this technology. In this work, a workflow based on the combined use of mathematical models and wet experimentation is proposed to accelerate the design of novel bioprocesses. In particular, a co-culture consisting of Pediococcus pentosaceus and Megaphaera cerevisiae is used to target the production of high-value odd- and even‑carbon VFA. An unstructured kinetic model was developed, calibrated and used to design experiments with the goal of increasing the selectivity for the desired VFA, which were experimentally validated. In the case of even‑carbon VFA, the experimental validation showed an increase of 38 % in caproate yield and, in the case of enhanced odd‑carbon VFA experiments, the yield of butyrate and caproate diminished by 62 % and 94 %, respectively, while propionate became one of the main end products and valerate yield value increased from 0.007 to 0.085 g<sub>valearte</sub> per g<sub>consumed sugar.</sub> The workflow followed in this work proved to be a sound tool for bioprocess design due to its capacity to explore and design new experiments in silico in a fast way and ability to quickly adapt to new scenarios.",The Science of the total environment,2023,None,10.1016/j.scitotenv.2022.159521,1,Defined,Food waste,VFA,"Pediococcus pentosaceus, Megasphaera cerevisiae","Lactobacillaceae, Veillonellaceae"
36243085,Mutualistic microbial community of Bacillus amyloliquefaciens and recombinant Yarrowia lipolytica co-produced lipopeptides and fatty acids from food waste.,"Bioconversion is an important method for transforming food waste (FW) into high value-added products, rendering it harmless, and recycling resources. An artificial microbial consortium (AMC) was constructed to produce FW-based lipopeptides in order to investigate the strategy of FW bioconversion into value-added products. Exogenous fatty acids as a precursor significantly improved the lipopeptide production of Bacillus amyloliquefaciens HM618. To enhance fatty acid synthesis and efflux in AMC, the recombinant Yarrowia lipolytica YL21 (strain YL21) was constructed by screening 12 target genes related to fatty acids to replace exogenous fatty acids in order to improve lipopeptide production. The levels of fengycin, surfactin, and iturin A in the AMC of strains HM618 and YL21 reached 76.19, 192.80, and 31.32 mg L<sup>-1</sup>, increasing 7.24-, 12.13-, and 3.23-fold compared to the results from the pure culture of strain HM618 in flask with Landy medium, respectively. Furthermore, free fatty acids were almost undetectable in the co-culture of strains HM618 and YL21, although its level was around 1.25 g L<sup>-1</sup> in the pure culture of strain YL21 with Landy medium. Interestingly, 470.24 mg L<sup>-1</sup> of lipopeptides and 18.11 g L<sup>-1</sup> of fatty acids were co-produced in this AMC in a bioreactor with FW medium. To our knowledge, it is the first report of FW biotransformation into co-produce of lipopeptides and fatty acids in the AMC of B. amyloliquefaciens and Y. lipolytica. These results provide new insights into the biotransformation potential of FW for value-added co-products by AMC.",Chemosphere,2023,None,10.1016/j.chemosphere.2022.136864,1,Defined,Food waste,"Lipopeptides, Fatty acid","Bacillus amyloliquefaciens, Yarrowia lipolytica","Bacillaceae, Dipodascaceae"
29486411,Engineering of artificial microbial consortia of Ralstonia eutropha and Bacillus subtilis for poly(3-hydroxybutyrate-co-3-hydroxyvalerate) copolymer production from sugarcane sugar without precursor feeding.,"Ralstonia eutropha is a well-known microbe reported for polyhydroxyalkonate (PHA) production, and unable to utilize sucrose as carbon source. Two strains, Ralstonia eutropha H16 and Ralstonia eutropha 5119 were co-cultured with sucrose hydrolyzing microbes (Bacillus subtilis and Bacillus amyloliquefaciens) for PHA production. Co-culture of B. subtilis:R. eutropha 5119 (BS:RE5) resulted in best PHA production (45% w/w dcw). Optimization of the PHA production process components through response surface resulted in sucrose: NH<sub>4</sub>Cl:B. subtilis: R. eutropha (3.0:0.17:0.10:0.190). Along with the hydrolysis of sucrose, B. subtilis also ferments sugars into organic acid (propionic acid), which acts as a precursor for HV monomer unit. Microbial consortia of BS:RE5 when cultured in optimized media led to the production of poly(3-hydroxybutyrate-co-3-hydroxyvalerate) (P(3HB-co-3HV) with 66% w/w of dcw having 16 mol% HV fraction. This co-culture strategy overcomes the need for metabolic engineering of R. eutropha for sucrose utilization, and addition of precursor for copolymer production.",Bioresource technology,2018,None,10.1016/j.biortech.2018.02.056,1,Defined,Sucrose,Polyhydroxyalkanoate,"Ralstonia eutropha, Bacillus subtilis","Burkholderiaceae, Bacillaceae"
31295575,Bacterial cellulose/hyaluronic acid nanocomposites production through co-culturing Gluconacetobacter hansenii and Lactococcus lactis in a two-vessel circulating system.,"Bacterial cellulose (BC) based composites have been widely studied in the biomedical field. In this study, the BC/HA (hyaluronic acid) nanocomposites in the pellicle form were directly produced through co-culturing Gluconacetobacter hansenii ATCC 23769 and Lactococcus lactis APJ3 in a novel two-vessel circulating system. The concentration of HA secreted by L. lactis was controlled through adjusting the constant feed rate of glucose. The dynamic growth of the strains revealed that L. lactis was mainly growing within 48 h while G. hansenii started to grow after 48 h. XRD analysis indicated the presence of HA would not affect the crystallinity of cellulose but increase the crystalline sizes. The FESEM images showed that more ribbons within the width of 20-40 nm and larger ribbons between 180 and 360 nm were observed in BC/HA. The strain at break and the water holding capacity of BC/HA increased with the concentration of HA.",Bioresource technology,2019,None,10.1016/j.biortech.2019.121715,1,Defined,Glucose,"Bacterial cellulose, Hyaluronic acid","Gluconacetobacter hansenii, Lactococcus lactis","Acetobacteraceae, Streptococcaceae"
33992112,Enhanced cercosporin production by co-culturing Cercospora sp. JNU001 with leaf-spot-disease-related endophytic bacteria.,"Owing to the excellent properties of photosensitization, cercosporin, one of naturally occurring perylenequinonoid pigments, has been widely used in photodynamic therapy, or as an antimicrobial agent and an organophotocatalyst. However, because of low efficiency of total chemical synthesis and low yield of current microbial fermentation, the limited production restricts its broad applications. Thus, the strategies to improve the production of cercosporin were highly desired. Besides traditional optimization methods, here we screened leaf-spot-disease-related endophytic bacteria to co-culture with our previous identified Cercospora sp. JNU001 to increase cercosporin production.",Microbial cell factories,2021,8126151,10.1186/s12934-021-01587-2,1,Defined,Glucose,Cercosporin,"Cercospora sp, Bacillus velezensis, Lysinibacillus sp","Mycosphaerellaceae, Bacillaceae"
29314110,Polyhydroxyalkanoates (PHA) production in bacterial co-culture using glucose and volatile fatty acids as carbon source.,"Mixed bacterial cultures are increasingly being used in the production of polyhydroxyalkanoates (PHAs), as they have the potential to be more cost effective than axenic pure cultures. The purpose of this study was to use pure cultures in combination to identify their potential of PHA production. In this work we used volatile fatty acids (VFAs) and glucose as carbon source to check the ability of selected strains ST2 (Pseudomonas sp.) and CS8 (Bacillus sp.) as co-culture. The production of PHA in pure co-cultures of bacteria was therefore investigated in order to understand the effect of combining cultures on PHA production parameters and material properties. Bacteria could use the feed in better way when mixed as compared to individual strain. In undertaking this analysis, model volatile fatty acids (i.e., acetic and propionic acids) were used alone and in combination with glucose as feedstock. The production by Pseudomonas was 34% while 24% by Bacillus. However when combined and mixed feed (glucose + propionic acid) was used, 35% PHA produced. Overall, it was found that the ability of the pure cultures to produce PHA was low but when selected cultures were mixed, their ability to produce PHA was enhanced. Copolymers were obtained instead of homopolymers with improved properties. This suggests that industrial wastewater rich in volatile fatty acids and carbohydrates can be a good carbon source for PHA production with variable properties.",Journal of basic microbiology,2018,None,10.1002/jobm.201700276,1,Defined,"Glucose, VFA_s",Polyhydroxyalkanoate,"Pseudomonas sp, Bacillus subtilis","Bacillaceae, Pseudomonas"
