PM_ID,Title,Abstract,Journal,Year,PMC_ID,DOI,Classification,Community type,Substrate,Product,Organisms,Family
28039824,Design and composition of synthetic fungal-bacterial microbial consortia that improve lignocellulolytic enzyme activity.,"Microbial interactions are important for metabolism as they can improve or reduce metabolic efficiency. To improve lignocellulolytic enzyme activity, a series of synergistic microbial consortia of increasing diversity and complexity were devised using fungal strains, including Trichoderma reesei, Penicillium decumbens, Aspergillus tubingensis, and Aspergillus niger. However, when a screened microbial community with cellulolytic capacity was added to the consortia to increase the number of strains, it engendered more microbial interactions with the above strains and universally improved the β-glucosidase activity of the consortia. Analysis of the microbial community structure revealed that the bacteria in the consortia are more important for lignocellulolytic enzyme activity than the fungi. One fungal and 16 bacterial genera in the consortia may interact with T. reesei and are potential members of a devised synergistic microbial consortium. Such devised microbial consortia may potentially be applied to effectively and economically degrade lignocellulose.",Bioresource technology,2017,None,10.1016/j.biortech.2016.12.058,1,Defined,Lignocellulose,Glucose_p,"Trichoderma reesei, Penicillium decumbens, Aspergillus tubingensis, Aspergillus niger","Hypocreaceae, Aspergillaceae"
35184225,Effects of pullulan additive and co-culture of Aureobasidium pullulans on bacterial cellulose produced by Komagataeibacter hansenii.,"Bacterial cellulose (BC) exhibits a unique combination of porosity, tensile strength, reticulated crystal structure and biocompatibility useful for many applications in the food, biomedical and other industries. Polysaccharide addition has been shown to improve the production and the mechanical properties of BC nanocomposites. This study examined the effect of pullulan on BC fermentation as well as the co-culturing of the BC producer with Aureobasidium pullulans, a fungal strain that produces pullulan as an exopolysaccharide. Results showed that a 1% pullulan addition improved Young's modulus of BC pellicles for sixfold. Addition of pullulan at 1.5% and 2% levels could increase the BC production from 0.447 to 0.814 and 1.997 g/L, respectively. The co-culture fermentation demonstrated a mixed effect on the aggregation and bundling of BC while resulting in a significant improvement in mechanical properties. The study provided a polysaccharide additive and a novel fermentation method to produce BC with improved properties.",Bioprocess and biosystems engineering,2022,None,10.1007/s00449-021-02680-x,1,Defined,Glucose,Bacterial cellulose,"Aureobasidium pullulans, Komagataeibacter hansenii","Saccotheciaceae, Acetobacteraceae"
31687553,Crude extracts of metabolites from co-cultures of lactic acid bacteria are highly antagonists of <i>Listeria monocytogenes</i>.,"<i>Listeria monocytogenes</i> is a pathogen difficult to control, due to its resistance to extreme conditions. The antimicrobial activity of a mixture of metabolites produced by lactic acid bacteria was evaluated against <i>L. monocytogenes</i>. Bacterial combined cultures in 1:1 ratio of <i>Lactobacillus plantarum</i> and <i>Weissella cibaria</i> (treatment LP + WC) and mixtures in ratio 1:1:1 of <i>Lactobacillus brevis, L. plantarum,</i> and <i>W. cibaria</i>, (treatment (LB + LP + WC) were grown by discontinuous fermentation, at 32 °C for 48 h. At 1, 2, 6, 12, 24 and 48 h of fermentation, samples were taken, the biomass was separated from the metabolites, and the antimicrobial activity of the metabolites was measured <i>in vitro</i> against <i>L. monocytogenes</i>. For comparison, experimental data published in the literature corresponding to monocultures of <i>L. brevis</i> (L.B), <i>L. plantarum</i> (LP) and <i>W. cibaria</i> (WC) were used. The antimicrobial activity was measured by a surface diffusion technique using absorbent paper discs impregnated with 60 μl from each metabolite and placed on the TSA agar surface (36 °C, 24 h). The metabolites from the microbial mixtures showed statistical differences with respect to their respective monocultures. With the treatment (LP + WC) an inhibition diameter of 2.54 cm was obtained at 12 h of fermentation, this value was higher than those obtained in the monoculture LP (2.19 cm), and WC (2.44 cm), during the same period. In the mixture (LB + LP + WC) during the first 12 h of fermentation, the antimicrobial activity was higher (2.12-2.28 cm) than the antimicrobial activity of the monoculture LB (1.66-2.23 cm). The use of metabolites from the co-culture of <i>L brevis, L. plantarum</i> and <i>W. cibaria</i> under the evaluated conditions, potentiate the antimicrobial activity of <i>L. brevis</i> against <i>L. monocytogenes,</i> therefore, they are promising in bio-preservation.",Heliyon,2019,6819814,10.1016/j.heliyon.2019.e02448,1,Defined,Amino acid medium,Antilisterial compounds,"Lactobacillus plantarum, Weissella cibaria",Lactobacillaceae
30708187,Microbial co-culturing strategies for fructo-oligosaccharide production.,"Fructo-oligosaccharide (FOS) mixtures produced by fermentation contain large amounts of non-prebiotic sugars. Here we propose a mixed culture of Aureobasidium pullulans and Saccharomyces cerevisiae cells to produce FOS and consume the small saccharides simultaneously, thereby increasing FOS purity in the mixture. The use of immobilised A. pullulans in co-culture with encapsulated S. cerevisiae, inoculated after 10 h fermentation, enhanced FOS production in a 5 L bioreactor. Using this strategy, a maximal FOS concentration of 119 g L<sup>-1</sup>, and yield of 0.59 g<sub>FOS</sub> g<sub>sucrose</sub><sup>-1</sup>, were obtained after 20 h fermentation, increasing FOS productivity from about 4.9 to 5.9 g<sub>FOS</sub> L<sup>-1</sup> h<sup>-1</sup> compared to a control fermentation of immobilized A. pullulans in monoculture. In addition, the encapsulated S. cerevisiae cells were able to decrease the glucose in the medium to about 7.6% (w/w) after 63 h fermentation. This provided a final fermentation mixture with 2.0% (w/w) sucrose and a FOS purity of over 67.0% (w/w). Moreover, a concentration of up to 58.0 g L<sup>-1</sup> of ethanol was obtained through the enzymatic transformation of glucose. The resulting pre-purified FOS mixture could improve the separation and purification of FOS in downstream treatments, such as simulated moving bed chromatography.",New biotechnology,2019,None,10.1016/j.nbt.2019.01.009,1,Defined,Saccharides,Fructo-oligosaccharide,"Aureobasidium pullulans, Saccharomyces cerevisiae","Saccotheciaceae, Saccharomycetaceae"
16345787,Ethanol Production by Thermophilic Bacteria: Fermentation of Cellulosic Substrates by Cocultures of Clostridium thermocellum and Clostridium thermohydrosulfuricum,,Applied and Environmental Microbiology,1981,243920,10.1128/aem.41.6.1337-1343.1981,,Defined,Cellulose,Ethanol,"Clostridium thermocellum, Clostridium thermohydrosulfuricum",Clostridiaceae
,Hydrogen and butanol production from native wheat straw by synthetic microbial consortia integrated by species of Enterococcus and Clostridium,,Fuel,2015,,,,Defined,Lignocellulose,"Hydrogen, Butanol","Enterococcus sp, Clostridium beijerinckii, Clostridium cellulovorans","Clostridiaceae, Enterococcaceae"
,Design and characterization of synthetic fungal-bacterial consortia for direct production of isobutanol from cellulosic biomass,,PNAS,2013,,,,Defined,Lignocellulose,Butanol,"Trichoderma reesei, Escherichia coli","Enterobacteriaceae, Hypocreaceae"
,Distributing a metabolic pathway among a microbial consortium enhances production of natural products,,Nature Biotechnology,2015,,,,Defined,Xylose,Pharmaceutically active compounds,"Escherichia coli, Saccharomyces cerevisiae","Saccharomycetaceae, Enterobacteriaceae"
,"A synthetic, light-driven consortium of cyanobacteria and heterotrophic bacteria enables stable polyhydroxybutyrate production",,Metabolic Engineering,2017,,,,Defined,Light,PHB,"Synechococcus elongatus, Halomonas boliviensis","Synechococcaceae, Halomonadaceae"
,Butanol Production from Crystalline Cellulose by Cocultured Clostridium thermocellum and Clostridium saccharoperbutylacetonicum N1-4,,Applied and Environmental Microbiology,2011,,,,Defined,Lignocellulose,Butanol,"Clostridium thermocellum, Clostridium saccharoperbutylacetonicum",Clostridiaceae
,Butanol production from alkali-pretreated rice straw by co-culture of Clostridium thermocellum and Clostridium saccharoperbutylacetonicum,,Bioresource Technology,2015,,,,Defined,Lignocellulose,Butanol,"Clostridium thermocellum, Clostridium saccharoperbutylacetonicum",Clostridiaceae
,De novo phenol bioproduction from glucose using biosensor-assisted microbial coculture engineering,,Biotechnology and Bioengineering,2019,,,,Defined,Glucose,Phenol,Escherichia coli,Enterobacteriaceae
,Balancing the non-linear rosmarinic acid biosynthetic pathway by modular co-culture engineering,,Metabolic Engineering,2019,,,,Defined,"Glucose, Sucrose, Xylose",Rosmarinic acid,Escherichia coli,Enterobacteriaceae
,Production of pyranoanthocyanins using Escherichia coli co-cultures,,Metabolic Engineering,2019,,,,Defined,Glucose,Pyranoanthocyanins,Escherichia coli,Enterobacteriaceae
,A heterogeneous microbial consortium producing short-chain fatty acids from lignocellulose ,,Science,2020,,,,Defined,Lignocellulose,SCFA,"Trichoderma reesei, Clostridium tyrobutyricum, Veillonella criceti, Megasphaera elsdenii","Hypocreaceae, Clostridiaceae, Veillonellaceae"
,Electricity Production from Cellulose in a Microbial Fuel Cell Using a Defined Binary Culture,,Environmental science & technology,2007,,,,Defined,Lignocellulose,Electricity,"Clostridium cellulolyticum, Geobacter sulfurreducens","Clostridiaceae, Geobacteraceae"
,Complete Biosynthesis of Anthocyanins Using E. coli Polycultures,,mBio,2017,,,,Defined,Glucose,Anthocyanins,Escherichia coli,Enterobacteriaceae
,Convergent engineering of syntrophic Escherichia coli coculture for efficient production of glycosides,,Metabolic Engineering,2018,,,,Defined,"Xylose, Glucose",Glycosides,Escherichia coli,Enterobacteriaceae
,Experimental and computational optimization of an Escherichia coli co-culture for the efficient production of flavonoids,,Metabolic Engineering,2016,,,,Defined,Glucose,Flavonoids,Escherichia coli,Enterobacteriaceae
,Production of Tyrian purple indigoid dye from tryptophan in Escherichia coli,,Nature Chemical Biology,2021,,,,Defined,Tryptophan,Indigo,Escherichia coli,Enterobacteriaceae
,Design of mutualistic microbial consortia for stable conversion of carbon monoxide to value-added chemicals,,Metabolic Engineering,2021,,,,Defined,CO,"3-hydroxypropionic acid, Itaconic acid","Eubacterium limosum, Escherichia coli","Eubacteriaceae, Enterobacteriaceae"
,Co_cultivation of anaerobic fungi with Clostridium acetobutylicum bolsters butyrate and butanol production from cellulose and lignocellulose,,Industrial Microbiology and Biotechnology,2022,,,,Defined,Lignocellulose,"Butyrate, Butanol","Clostridium acetobutylicum, Anaeromyces robustus, Neocallimastix californiae, Caecomyces churrovis","Clostridiaceae, Neocallimastigaceae"
19002762,Hydrogen production and anaerobic decolorization of wastewater containing Reactive Blue 4 by a bacterial consortium of Salmonella subterranea and Paenibacillus polymyxa.,"Anaerobic biodegradability of wastewater (3,000 mg CODcr/l) containing 300 mg/l Reactive Blue 4, with different co-substrates, glucose, butyrate and propionate by a bacterial consortium of Salmonella subterranea and Paenibacillus polymyxa, concomitantly with hydrogen production was investigated at 35 degrees C. The accumulative hydrogen production at 3,067 mg CODcr/l was obtained after 7 days of incubation with glucose, sludge, the bacterial consortium. The volatile fatty acids, residual glucose and the total organic carbon were correlated to hydrogen obtained. Interestingly, the bacterial consortium possess decolorization ability showing approximately 24% dye removal after 24 h incubation using glucose as a co-substrate, which was about two and eight times those of butyrate (10%), propionate (12%) and control (3%), respectively. RB4 decolorization occurred through acidogenesis, as high volatile fatty acids but low methane was detected. The bacterial consortium will be the bacterial strains of interest for further decolorization and hydrogen production of industrial waste water.",Biodegradation,2009,None,10.1007/s10532-008-9232-0,1,Defined,Wastewater sludge,Hydrogen,"Salmonella subterranea, Paenibacillus polymyxa","Enterobacteriaceae, Paenibacillaceae"
21954885,"Glionitrin B, a cancer invasion inhibitory diketopiperazine produced by microbial coculture.","A new diketopiperazine, glionitrin B (1), was produced using a microbial coculture of the fungus Aspergillus fumigatus KMC-901 and the bacterium Sphingomonas sp. KMK-001 that were isolated from acidic coal mine drainage. The structure of 1 was determined to be (3S,10aS)-dithiomethylglionitrin A. This structure was determined by the analyses of extensive NMR data and the circular dichroism spectra of the natural product and a semisynthetic compound derived from glionitrin A. In contrast to glionitrin A (2), glionitrin B (1) is not cytotoxic against the human prostate cancer cell line DU145. However, compound 1 caused suppression of DU145 cell invasion, producing 46% inhibition at 60 μM.",Journal of natural products,2011,None,10.1021/np200563x,1,Defined,Sucrose,Glionitrin B,"Aspergillus fumigatus, Sphingomonas sp","Aspergillaceae, Sphingomonadaceae"
32946127,Consolidated bioprocessing performance of a two-species microbial consortium for butanol production from lignocellulosic biomass.,"Consolidated bioprocessing (CBP) by using microbial consortium was considered as a promising approach to achieve direct biofuel production from lignocellulose. In this study, the interaction mechanism of microbial consortium consisting of Thermoanaerobacterium thermosaccharolyticum M5 and Clostridium acetobutylicum NJ4 was analyzed, which could achieve efficient butanol production from xylan through CBP. Strain M5 possesses efficient xylan degradation capability, as 19.73 g/L of xylose was accumulated within 50 hr. The efficient xylose utilization capability of partner strain NJ4 could relieve the substrate inhibition to hydrolytic enzymes of xylanase and xylosidase secreted by strain M5. In addition, the earlier solventogenesis of strain NJ4 was observed due to the existence of butyrate generated by strain M5. The mutual interaction of these two strains finally gave 13.28 g/L of butanol from 70 g/L of xylan after process optimization, representing a relatively high butanol production from hemicellulose. Moreover, 7.61 g/L of butanol was generated from untreated corncob via CBP. This successfully constructed microbial consortium exhibits efficient cooperation performance on butanol production from lignocellulose, which could provide a platform for the emerging butanol production from lignocellulose.",Biotechnology and bioengineering,2020,None,10.1002/bit.27464,1,Defined,Lignocellulose,Butanol,"Thermoanaerobacterium thermosaccharolyticum, Clostridium acetobutylicum","Thermoanaerobacterales, Clostridiaceae"
32090083,Statistical Experimental Design Optimization of Microbial Proteases Production under Co-Culture Conditions for Chitin Recovery from Speckled Shrimp <i>Metapenaeus monoceros</i> By-Product.,"This study was designed with the aim to produce microbial proteases in presence of speckled shrimp by-product. For this reason, three strains belonging to <i>Bacillus</i> genus, namely, <i>Aeribacillus pallidus</i> VP3, <i>Lysinibacillus fusiformis</i> C250R, and <i>Anoxybacillus kamchatkensis</i> M1V were studied under co-culture procedure. A Taguchi L27 experimental design was applied to optimize the co-culture parameters. The experimental design was built with 9 factors (by-product powder concentration, the pH of the medium, the temperature, the sucrose concentration, the agitation speed, the inoculum sizes of VP3, M1V, and C250R strains, and the culture volume) at three different levels. The obtained results showed that a total protease activity of 8,182 U/mL could be achieved after 24 h of incubation in presence of 20 g/L shrimp by-product and 10 g/L sucrose, at an initial pH of 7, a 40°C temperature and absorbance, at 600 nm, of inoculum sizes of 0.1, 0.3, and 0.1 for VP3, M1V, and C250R strains, respectively. The agitation was set at 200 rpm, and the final volume was 25 mL. Taguchi's design allowed the identification of temperature, the inoculum size for strain VP3, the inoculum size for strain M1V, and the final culture volume as the most influencing variables. A Box-Behnken design with 27 experiments was carried out for the optimization of these four selected factors. Following such design, the highest protease production reached was 11,300 U/mL. This yield was obtained in a final culture volume of 15 mL containing 20 g/L shrimp by-product powder and 10 g/L sucrose and inoculated with VP3, C250R, and M1V strains at 0.05, 0.1, and 0.2, respectively. The flasks were incubated at 45°C for 24 h with shaking at 200 rpm. The efficiency of chitin extraction by co-cultivation was investigated under the latter conditions. The chitin yield from shells by-product was 16.7%. Fourier-Transform Infrared (FTIR) analysis of the obtained chitin displayed characteristic profiles similar to that of the commercial <i>α</i>-chitin.",BioMed research international,2020,6998744,10.1155/2020/3707804,1,Defined,"Food waste, Sucrose",Microbial proteases,"Aeribacillus pallidus, Lysinibacillus fusiformis, Anoxybacillus kamchatkensis",Bacillaceae
27042211,Production of medium-chain fatty acids and higher alcohols by a synthetic co-culture grown on carbon monoxide or syngas.,"Synthesis gas, a mixture of CO, H2, and CO2, is a promising renewable feedstock for bio-based production of organic chemicals. Production of medium-chain fatty acids can be performed via chain elongation, utilizing acetate and ethanol as main substrates. Acetate and ethanol are main products of syngas fermentation by acetogens. Therefore, syngas can be indirectly used as a substrate for the chain elongation process.",Biotechnology for biofuels,2016,4818930,10.1186/s13068-016-0495-0,1,Defined,"CO, Syngas",MCFA,"Clostridium autoethanogenum, Clostridium kluyveri",Clostridiaceae
33990298,Propionate Production from Carbon Monoxide by Synthetic Cocultures of Acetobacterium wieringae and Propionigenic Bacteria.,"Gas fermentation is a promising way to convert CO-rich gases to chemicals. We studied the use of synthetic cocultures composed of carboxydotrophic and propionigenic bacteria to convert CO to propionate. So far, isolated carboxydotrophs cannot directly ferment CO to propionate, and therefore, this cocultivation approach was investigated. Four distinct synthetic cocultures were constructed, consisting of Acetobacterium wieringae (DSM 1911<sup>T</sup>) and Pelobacter propionicus (DSM 2379<sup>T</sup>), <i>Ac. wieringae</i> (DSM 1911<sup>T</sup>) and Anaerotignum neopropionicum (DSM 3847<sup>T</sup>), <i>Ac. wieringae</i> strain JM and <i>P. propionicus</i> (DSM 2379<sup>T</sup>), and <i>Ac. wieringae</i> strain JM and <i>An. neopropionicum</i> (DSM 3847<sup>T</sup>). Propionate was produced by all the cocultures, with the highest titer (∼24 mM) being measured in the coculture composed of <i>Ac. wieringae</i> strain JM and <i>An. neopropionicum</i>, which also produced isovalerate (∼4 mM), butyrate (∼1 mM), and isobutyrate (0.3 mM). This coculture was further studied using proteogenomics. As expected, enzymes involved in the Wood-Ljungdahl pathway in <i>Ac. wieringae</i> strain JM, which are responsible for the conversion of CO to ethanol and acetate, were detected; the proteome of <i>An. neopropionicum</i> confirmed the conversion of ethanol to propionate via the acrylate pathway. In addition, proteins related to amino acid metabolism and stress response were highly abundant during cocultivation, which raises the hypothesis that amino acids are exchanged by the two microorganisms, accompanied by isovalerate and isobutyrate production. This highlights the importance of explicitly looking at fortuitous microbial interactions during cocultivation to fully understand coculture behavior. <b>IMPORTANCE</b> Syngas fermentation has great potential for the sustainable production of chemicals from wastes (via prior gasification) and flue gases containing CO/CO<sub>2</sub>. Research efforts need to be directed toward expanding the product portfolio of gas fermentation, which is currently limited to mainly acetate and ethanol. This study provides the basis for a microbial process to produce propionate from CO using synthetic cocultures composed of acetogenic and propionigenic bacteria and elucidates the metabolic pathways involved. Furthermore, based on proteomics results, we hypothesize that the two bacterial species engage in an interaction that results in amino acid exchange, which subsequently promotes isovalerate and isobutyrate production. These findings provide a new understanding of gas fermentation and a coculturing strategy for expanding the product spectrum of microbial conversion of CO/CO<sub>2</sub>.",Applied and environmental microbiology,2021,8231444,10.1128/AEM.02839-20,1,Defined,"CO, Syngas",Propionate,"Acetobacterium wieringae, Pelobacter propionicus, Anaerotignum neopropionicum","Eubacteriaceae, Desulfuromonadaceae, Lachnospiraceae"
28429329,Hydrogen production and microbial kinetics of Clostridium termitidis in mono-culture and co-culture with Clostridium beijerinckii on cellulose.,"Cellulose utilization by hydrogen producers remains an issue due to the low hydrogen yields reported and the pretreatment of cellulose prior to fermentation requires complex and expensive steps. Clostridium termitidis is able to breakdown cellulose into glucose and produce hydrogen. On the other hand, Clostridium beijerinckii is not able to degrade cellulose but is adept at hydrogen production from glucose; therefore, it was chosen to potentially enhance hydrogen production when co-cultured with C. termitidis on cellulose. In this study, batch fermentation tests were conducted to investigate the direct hydrogen production enhancement of mesophilic cellulolytic bacteria C. termitidis co-cultured with mesophilic hydrogen producer C. beijerinckii on cellulose at 2 g l<sup>-1</sup> compared to C. termitidis mono-culture. Microbial kinetics parameters were determined by modeling in MATLAB. The achieved highest hydrogen yield was 1.92 mol hydrogen mol<sup>-1</sup> hexose equivalent<sub>added</sub> in the co-culture compared to 1.45 mol hydrogen mol<sup>-1</sup> hexose equivalent<sub>added</sub> in the mono-culture. The maximum hydrogen production rate of 26 ml d<sup>-1</sup> was achieved in the co-culture. Co-culture exhibited an overall 32 % enhancement of hydrogen yield based on hexose equivalent added and 15 % more substrate utilization. The main metabolites were acetate, ethanol, lactate, and formate in the mono-culture, with also butyrate in the co-culture. Additionally, the hydrogen yield of C. beijerinckii only in glucose was 2.54 mol hydrogen mol<sup>-1</sup> hexose equivalent. This study has proved the viability of co-culture of C. termitidis with C. beijerinckii for hydrogen production directly from a complex substrate like cellulose under mesophilic conditions.",AMB Express,2017,5399015,10.1186/s13568-016-0256-2,1,Defined,Cellulose,Hydrogen,"Clostridium termitidis, Clostridium beijerinckii",Clostridiaceae
32625017,Establishing microbial co-cultures for 3-hydroxybenzoic acid biosynthesis on glycerol.,"Converting renewable feedstocks to aromatic compounds using engineered microbes offers a robust approach for sustainable, environment-friendly, and cost-effective production of these value-added products without the reliance on petroleum. In this study, rationally designed <i>E. coli-E. coli</i> co-culture systems were established for converting glycerol to 3-hydroxybenzoic acid (3HB). Specifically, the 3HB pathway was modularized and accommodated by two metabolically engineered <i>E. coli</i> strains. The co-culture biosynthesis was optimized by using different cultivation temperatures, varying the inoculum ratio between the co-culture strains, recruitment of a key pathway intermediate transporter, strengthening the critical pathway enzyme expression, and adjusting the timing for inducing pathway gene expression. Compared with the <i>E. coli</i> mono-culture, the optimized co-culture showed 5.3-fold improvement for 3HB biosynthesis. This study demonstrated the applicability of modular co-culture engineering for addressing the challenges of aromatic compound biosynthesis.",Engineering in life sciences,2019,6999546,10.1002/elsc.201800195,1,Defined,Glycerol,3-hydroxybenzoic acid,Escherichia coli,Enterobacteriaceae
